{
  "$schema": "edx-agency/handoff/tester@1",
  "phase": 0,
  "date": "2026-04-07",
  "status": "completed",
  "from": "tester",
  "results": {
    "passed": 3,
    "failed": 0,
    "skipped": 0
  },
  "acceptanceCriteriaStatus": [
    { "id": "AC-1", "status": "pass", "testFile": "src/server.test.ts", "line": 12 },
    { "id": "AC-2", "status": "pass", "testFile": "src/server.test.ts", "line": 20 },
    { "id": "AC-3", "status": "pass", "testFile": "src/server.test.ts", "line": 28 },
    { "id": "AC-4", "status": "skipped" },
    { "id": "AC-5", "status": "skipped" }
  ],
  "failingTests": [],
  "blockingFailures": false,
  "coverageNotes": "AC-4 (config validation) and AC-5 (log field structure) are not covered by the server integration tests. AC-4 requires process.env manipulation which is out of scope for this phase; AC-5 requires log output capture. Both are non-blocking and should be addressed in a dedicated config and logging test file in phase 0.2.",
  "complianceChecks": {
    "tsIgnoreFound": false,
    "asAnyFound": false,
    "requireInSrcFound": false,
    "hardcodedUserStringsFound": false,
    "layerViolationFound": false,
    "esmImportsInvalid": false,
    "untrackedTempFilesFound": false,
    "notes": ""
  }
}
